{"$schema":"../../../schemas/t07-bounded-smoke-plan-v2.schema.json","bootstrap_argv_template":["/usr/bin/python3","-I","/home/ubuntu/t07-bounded-bootstrap.py","--bootstrap-file-sha256","${REMOTE_BOOTSTRAP_SHA256}","--bundle-archive","/home/ubuntu/t07-bounded-repository.tar","--bundle-archive-sha256","${BUNDLE_ARCHIVE_SHA256}","--bundle-manifest-sha256","${BUNDLE_MANIFEST_SHA256}","--plan","/home/ubuntu/t07-bounded-bundle/containers/sira-smoke/bounded/bounded-smoke-plan-v2.json","--plan-sha256","${PLAN_SHA256}","--contract-file","/home/ubuntu/t07-bounded-bundle/src/giclab/harness/t07_bounded_smoke.py","--contract-sha256","${CONTRACT_SHA256}","--authorization","/home/ubuntu/t07-bounded-authorization.json","--authorization-sha256","${AUTHORIZATION_SHA256}","--bootstrap-release","/home/ubuntu/t07-bounded-bootstrap-release.json","--bootstrap-release-sha256","${BOOTSTRAP_RELEASE_SHA256}","--bundle-root","/home/ubuntu/t07-bounded-bundle","--secret-file","/home/ubuntu/.config/giclab/sira_api_key","--output-root","/home/ubuntu/t07-bounded-output-0002"],"conditions":[{"api_cost_usd":2.0,"attempt":1,"browser_actions":1,"condition":"SIRA-REACTIVE","container_create_argv_template":["/usr/bin/docker","create","--name","t07-bounded-reactive-0002","--pull","never","--platform","linux/amd64","--network","bridge","--pid","private","--ipc","private","--cgroupns","private","--cap-drop","ALL","--security-opt","no-new-privileges=true","--read-only","--init","--restart","no","--cpus","2.000","--memory","4294967296","--memory-swap","4294967296","--pids-limit","512","--shm-size","1073741824","--tmpfs","/tmp:rw,noexec,nosuid,nodev,size=134217728,uid=1000,gid=1000,mode=0700","--log-driver","local","--log-opt","max-size=8388608","--log-opt","max-file=1","--user","1000:1000","--label","org.giclab.t07.experiment=EXP-0001","--label","org.giclab.t07.profile=PLAN-T07-BOUNDED-SIRA-SMOKE-V2","--label","org.giclab.t07.condition=SIRA-REACTIVE","--label","org.giclab.t07.run-id=RUN-T07-BOUNDED-SIRA-REACTIVE-0002","--label","org.giclab.t07.attempt=1","--label","org.giclab.t07.repository-commit=${EXECUTION_COMMIT}","--label","org.giclab.t07.source-commit=93fb8d72de71f9a4a13419670adeb34d93cf7acd","--label","org.giclab.t07.authorization=${AUTHORIZATION_REFERENCE}","--tmpfs","/giclab/attempt:rw,noexec,nosuid,nodev,size=67108864,uid=1000,gid=1000,mode=0700","--mount","type=bind,src=${SIRA_SECRET_FILE},dst=/run/secrets/sira_api_key,readonly","--entrypoint","/usr/bin/python3","${IMAGE_ID}","/opt/giclab/container_entrypoint.py","--supervised-release","--","/opt/sira/.venv/bin/python","/opt/giclab-src/giclab/harness/sira_gate_a_runtime.py","--gate-upstream-runner","/opt/sira/scripts/run_web_agent.py","--gate-attempt-root","/giclab/attempt","--gate-mode","reactive","--gate-adaptation-sha256","c461dce20fea9e743135cad98b664213a393e46f35d1c1a8434212b2f0367dbb","--","EXP-0001-SMOKE-REACTIVE","--query","go to google flights","--mode","reactive","--agent","sira","--model","gpt-4o-2024-11-20","--max_steps","1","--timeout","30","--max_retry","0","--output_dir","/giclab/attempt/sira-output","--seed","42"],"container_create_template_sha256":"232b77f5227e965774b69ac7b4490e3ffe6a8b7d0627c691b2ec616a7f332f97","inner_argv_template":["/opt/sira/.venv/bin/python","/opt/giclab-src/giclab/harness/sira_gate_a_runtime.py","--gate-upstream-runner","/opt/sira/scripts/run_web_agent.py","--gate-attempt-root","/giclab/attempt","--gate-mode","reactive","--gate-adaptation-sha256","c461dce20fea9e743135cad98b664213a393e46f35d1c1a8434212b2f0367dbb","--","EXP-0001-SMOKE-REACTIVE","--query","go to google flights","--mode","reactive","--agent","sira","--model","gpt-4o-2024-11-20","--max_steps","1","--timeout","30","--max_retry","0","--output_dir","/giclab/attempt/sira-output","--seed","42"],"inner_argv_template_sha256":"e2202f393a5958a4609286b21c07ba4feb1255e38d6a4dab78cf08d718f9533d","mode":"reactive","model_call_attempts":16,"model_tokens":200000,"order_index":1,"output_bytes":104857600,"run_id":"RUN-T07-BOUNDED-SIRA-REACTIVE-0002","wall_seconds":120},{"api_cost_usd":2.0,"attempt":1,"browser_actions":1,"condition":"SIRA-SIMULATIVE","container_create_argv_template":["/usr/bin/docker","create","--name","t07-bounded-simulative-0002","--pull","never","--platform","linux/amd64","--network","bridge","--pid","private","--ipc","private","--cgroupns","private","--cap-drop","ALL","--security-opt","no-new-privileges=true","--read-only","--init","--restart","no","--cpus","2.000","--memory","4294967296","--memory-swap","4294967296","--pids-limit","512","--shm-size","1073741824","--tmpfs","/tmp:rw,noexec,nosuid,nodev,size=134217728,uid=1000,gid=1000,mode=0700","--log-driver","local","--log-opt","max-size=8388608","--log-opt","max-file=1","--user","1000:1000","--label","org.giclab.t07.experiment=EXP-0001","--label","org.giclab.t07.profile=PLAN-T07-BOUNDED-SIRA-SMOKE-V2","--label","org.giclab.t07.condition=SIRA-SIMULATIVE","--label","org.giclab.t07.run-id=RUN-T07-BOUNDED-SIRA-SIMULATIVE-0002","--label","org.giclab.t07.attempt=1","--label","org.giclab.t07.repository-commit=${EXECUTION_COMMIT}","--label","org.giclab.t07.source-commit=93fb8d72de71f9a4a13419670adeb34d93cf7acd","--label","org.giclab.t07.authorization=${AUTHORIZATION_REFERENCE}","--tmpfs","/giclab/attempt:rw,noexec,nosuid,nodev,size=67108864,uid=1000,gid=1000,mode=0700","--mount","type=bind,src=${SIRA_SECRET_FILE},dst=/run/secrets/sira_api_key,readonly","--entrypoint","/usr/bin/python3","${IMAGE_ID}","/opt/giclab/container_entrypoint.py","--supervised-release","--","/opt/sira/.venv/bin/python","/opt/giclab-src/giclab/harness/sira_gate_a_runtime.py","--gate-upstream-runner","/opt/sira/scripts/run_web_agent.py","--gate-attempt-root","/giclab/attempt","--gate-mode","simulative","--gate-adaptation-sha256","c461dce20fea9e743135cad98b664213a393e46f35d1c1a8434212b2f0367dbb","--","EXP-0001-SMOKE-SIMULATIVE","--query","go to google flights","--mode","simulative","--agent","sira","--model","gpt-4o-2024-11-20","--max_steps","1","--timeout","30","--max_retry","0","--output_dir","/giclab/attempt/sira-output","--seed","42"],"container_create_template_sha256":"4db427482288ef002a37097125beffcdff010a3a55585c4c07d90d599d6247f7","inner_argv_template":["/opt/sira/.venv/bin/python","/opt/giclab-src/giclab/harness/sira_gate_a_runtime.py","--gate-upstream-runner","/opt/sira/scripts/run_web_agent.py","--gate-attempt-root","/giclab/attempt","--gate-mode","simulative","--gate-adaptation-sha256","c461dce20fea9e743135cad98b664213a393e46f35d1c1a8434212b2f0367dbb","--","EXP-0001-SMOKE-SIMULATIVE","--query","go to google flights","--mode","simulative","--agent","sira","--model","gpt-4o-2024-11-20","--max_steps","1","--timeout","30","--max_retry","0","--output_dir","/giclab/attempt/sira-output","--seed","42"],"inner_argv_template_sha256":"0c02c8143f3c2ce14becb9ab6921363c6ccc19bd3106a31f618fd8851bea7db4","mode":"simulative","model_call_attempts":61,"model_tokens":200000,"order_index":2,"output_bytes":104857600,"run_id":"RUN-T07-BOUNDED-SIRA-SIMULATIVE-0002","wall_seconds":120}],"container_lifecycle":{"container_residue":["/usr/bin/docker","ps","--all","--filter","label=org.giclab.t07.run-id=${RUN_ID}","--format","{{.ID}}"],"copy_out":["/usr/bin/docker","cp","${CONTAINER_ID}:/giclab/attempt/.","${HOST_ATTEMPT_ROOT}"],"inspect":["/usr/bin/docker","inspect","${CONTAINER_ID}"],"kill":["/usr/bin/docker","kill","${CONTAINER_ID}"],"logs":["/usr/bin/docker","logs","${CONTAINER_ID}"],"network_residue":["/usr/bin/docker","network","ls","--filter","label=org.giclab.t07.run-id=${RUN_ID}","--format","{{.ID}}"],"readiness":["/usr/bin/docker","exec","${CONTAINER_ID}","/usr/bin/test","-f","${READINESS_PATH}"],"release":["/usr/bin/docker","exec","${CONTAINER_ID}","/usr/bin/touch","/giclab/attempt/.giclab-release"],"remove":["/usr/bin/docker","rm","--force","${CONTAINER_ID}"],"start_attached":["/usr/bin/docker","start","--attach","${CONTAINER_ID}"],"start_detached":["/usr/bin/docker","start","${CONTAINER_ID}"],"stop":["/usr/bin/docker","stop","--time","5","${CONTAINER_ID}"],"top":["/usr/bin/docker","top","${CONTAINER_ID}","-eo","pid,ppid,pgid,sid,stat,comm,args"],"volume_residue":["/usr/bin/docker","volume","ls","--filter","label=org.giclab.t07.run-id=${RUN_ID}","--format","{{.Name}}"],"wait":["/usr/bin/docker","wait","${CONTAINER_ID}"]},"deferred_limitations":["manual_console_launch_is_not_exactly_once_api_proven","browser_descendant_containment_is_practical_not_formally_exhaustive","provider_or_control_plane_outage_can_extend_billing","runtime_supply_chain_pinning_is_practical_not_exhaustive_attestation","setup_is_manually_supervised_and_not_production_automation","setup_network_wire_bytes_are_admission_and_disk_accounted_not_exactly_metered","one_pair_smoke_has_no_scientific_power"],"execution_permissions_now":{"browser":false,"cloud_mutations":0,"containers":false,"jupyter":false,"lambda_account_requests":0,"openai_account_requests":0,"paid_compute":false,"scientific_execution":false,"sira":false},"hard_blockers":["repository_identity_drift","sira_source_identity_drift","immutable_model_unavailable","model_routing_mixed_or_floating","secret_channel_failure","projected_openai_api_cost_above_usd_4","lambda_price_or_projected_normal_cost_above_usd_2","evidence_root_not_fresh","selected_lambda_resource_unavailable","user_presence_unavailable","provider_termination_path_unavailable","prior_attempt_running_instance_unresolved"],"identity":{"authorization_reference":"AUTH-T07-BOUNDED-SIRA-SMOKE-V2-PENDING","authorized":false,"branch":"phase-1/sira-smoke-bounded","fork_commit":"397a391b736528dd1049023d629100193e823c49","frozen_tag":"t07-high-assurance-infrastructure-v1","host_run_id":"RUN-T07-BOUNDED-HOST-0002","parent_branch":"phase-1/sira-smoke-lambda","plan_id":"PLAN-T07-BOUNDED-SIRA-SMOKE-V2","schema_version":"0.1.0","state":"ready-for-bounded-smoke-v2-authorization"},"implementation":{"artifacts":[{"bytes":91,"path":"containers/sira-smoke/bounded/.dockerignore","sha256":"8ce9d7dcc5b558b3e3a89